text,text_hash,label,label_predicted,label_triggers,text_hash.1,label_count,label_predicted_count,label_count_matched
'Kicking' my boyfiend out of my student house and effectively leave him homeless.,2898337189,harm betrayal,care harm,synset-house-noun-1 kick_23020000 causeharm,2898337189,2,2,1
*Ed TW* I don't want to eat because I think it'll take my problem away.,864163804,harm,fairness,regard,864163804,1,1,0
5 How I lie to my family about go to school and literally waste my parent money.,1484528765,betrayal,authority,synset-parent-noun-1,1484528765,1,1,0
A Brit call me a racial epithet and I neglect to punch his face.,3237549569,harm degradation,harm,causeharm synset-punch-verb-1 punch_18020000,3237549569,2,1,1
"A co-worker I am in love with quit last week, but I am engaged.",2953713029,cheating,loyalty,collaboration synset-colleague-noun-1,2953713029,1,1,0
"A couple year ago, I break an egg and leave it in a jar for a week to see what would happen. It smell really bad.",2079925909,degradation,harm,causeharm break_45010000 destroying happen_48030000 experiencebodilyharm,2079925909,1,1,0
"A day before our vacation, i tell my relative to stop call and bother my mother while we are away, i have no regret lol.",327821962,harm betrayal,care,synset-mother-noun-1,327821962,2,1,0
A few month ago I think I realize that I am bi. Now I think it is more likely that I am lonely and afraid of guys.,2576099023,harm,fairness,regard,2576099023,1,1,0
A friend of mine be try to lure me into an organizational pyramid scheme. He doesn’t know that I know it’s a scam. I’ll drop the bomb on him soon though.,952515331,cheating,subversion harm,synset-bomb-noun-1 synset-scam-noun-1,952515331,1,2,0
A high school bully die at a car crash and I am relieve and frustrated.,1888622812,harm,harm,death die_48020000 synset-die-verb-1,1888622812,1,1,1
A nerd broke my nose by viciously ram my face into his thigh.,2695566800,harm,harm,experiencebodilyharm causeharm break_45010000,2695566800,1,1,1
A rant about leave an abusive house into a even more toxic environment.,2515409415,harm,care,synset-house-noun-1,2515409415,1,1,0
A relative boyfriend be cheat on her and she doesn't know. But I do. And he know i know.,1515200006,betrayal,cheating,cheat_59000100,1515200006,1,1,0
A shady guy from an apartment give me a bag of chip and I take them.,843847517,harm,harm,synset-bit-noun-2,843847517,1,1,1
Adam totally forget about the flower and let them wilt and die.,3865843400,cheating,harm,death die_48020000 synset-die-verb-1,3865843400,1,1,0
Affair With Sister's Boyfriend Gives Both Pleasure and Pain.,2402882897,harm betrayal degradation cheating subversion,harm,synset-pain-noun-1,2402882897,5,1,1
After 25 year my family have be rip apart RIGHT before the holidays.,482219902,harm betrayal,harm,synset-rend-verb-1,482219902,2,1,1
"After 5+ year of gradually erode away my interpersonal relationship and strictly limit my social interactions, I can finally admit..",2527604866,betrayal,betrayal oppression,synset-restrict-verb-3 revealsecret,2527604866,1,2,1
"After I fell out with my ex-best friend, I start like a boy she really hated.",312154841,betrayal,harm,hate_31020100,312154841,1,1,0
"After the ups and down of acne, I think now that I hate myself more than ever.",748297012,harm,fairness harm,synset-hate-verb-1 hate_31020100 regard,748297012,1,2,1
"After year of Extreme verbal and okay physical abuse, I’m leave with intrusive homocidal thought that I’m get use to.",3362008517,harm,fairness harm,synset-maltreatment-noun-1 abusing regard,3362008517,1,2,1
After year of abuse today be the day I call quits and beat my brother over the head with a vacuum clean.,2225415364,harm betrayal,harm,causeharm synset-maltreatment-noun-1 abusing synset-beat-verb-1,2225415364,2,1,1
Albert smoke cigarette even though his parent didn't approve.,3257734818,harm,authority harm,synset-parent-noun-1 synset-approve-verb-1,3257734818,1,2,1
Alex be tell by his parent to not mess with their computer at all.,338958267,harm cheating,authority care,synset-parent-noun-1 synset-computer-noun-1,338958267,2,2,0
Alex be vomit and in pain as his father drive him to the ER.,2138313894,harm,care harm,synset-vomit-verb-1 synset-pain-noun-1,2138313894,1,2,1
All my friend be too scared to sleep over because of my abusive mother.,2382305690,degradation harm,care,synset-mother-noun-1,2382305690,2,1,0
All the police officer rush to grab the guy and they catch him.,3526694504,subversion,care,synset-police-noun-1 synset-policeman-noun-1,3526694504,1,1,0
Am I ready to enter another relationship after abuse my ex-wife 10 year ago?.,846928676,harm,harm,synset-maltreatment-noun-1,846928676,1,1,1
Amy and her parent lose their house because they couldn't pay bills.,1379670199,harm,authority care harm,attack synset-lose-verb-1 synset-parent-noun-1 synset-house-noun-1 lose_13020000,1379670199,1,3,1
An old woman may or may not have call the police on me and my parent still don’t know.,1754603557,harm,authority care,synset-police-noun-1 synset-parent-noun-1,1754603557,1,2,0
And he iscame the first man to have the most food pump out of him.,162207558,harm,care,supply synset-food-noun-1 synset-pump-noun-1,162207558,1,1,0
Andy know the caller be a telemarketer try to sell him a vacation.,466425793,cheating,loyalty,synset-caller-noun-1,466425793,1,1,0
Animal Lover Forced to Choose Between Boyfriend and Her Pets.,2743997850,cheating subversion,fairness oppression,force_59000000 partiality,2743997850,2,2,0
Approximately 300 people nearly die and i think I am the only one who knows.,280828617,harm degradation,fairness harm,death die_48020000 regard synset-die-verb-1,280828617,2,2,1
"As I grow up, I am taught not to like Indian people. But the truth be that I respect and love their extensive culture and heritage.",2616012377,harm,fairness,synset-respect-verb-1,2616012377,1,1,0
As I sit in the doctor's office I wonder why I am even here.,1752896606,cheating,care,synset-doctor-noun-1,1752896606,1,1,0
As a cop sometimes I seize money from homeless people because I know they will use that money for food or drug.,3295160352,harm cheating,degradation care,synset-bull-noun-5 synset-food-noun-1 synset-drug-noun-1,3295160352,2,2,0
As a hobby I enjoy drive around with my window roll down and verbally abuse overweight woman.,522723870,harm,harm,abusing synset-mistreat-verb-1 abuse_33000000,522723870,1,1,1
As a kid I physically attack my father cause I think he is kidnap my sister.,4231862999,harm subversion,fairness care harm,attack_33000000 synset-attack-verb-1 attack regard,4231862999,2,3,1
"As a kid and young teenager, I am careless about leave container of old food out until they rotted..",3975422886,degradation,care,synset-food-noun-1,3975422886,1,1,0
"As a kid, I give my mom the silent treatment just because she didn't buy me a TMNT action figure.",1628512685,betrayal subversion,care,synset-treatment-noun-1 cure,1628512685,2,1,0
As a prank I sell a fake X box one to some kid on Craigslist.,1845105845,cheating,cheating,synset-bogus-adjectivesatellite-1,1845105845,1,1,1
"As a result of his carelessness, he stumble right into a huge patch.",1230444654,harm,care harm,synset-negligence-noun-1 supply synset-spot-noun-5 offenses,1230444654,1,2,1
"As an excuse for the day off of work, I tell my manager that my mother have died.",2092637247,betrayal cheating,care harm,death die_48020000 synset-mother-noun-1,2092637247,2,2,0
"As he is push the weight back up, his shoulder give him pain.",2451248498,harm,harm,synset-pain-noun-1,2451248498,1,1,1
"As she didn't find anything conclusive, she go to a doctor.",1933317356,harm,care,synset-detect-verb-1 synset-doctor-noun-1,1933317356,1,1,0
"As well as the normal activities, he would help to campaign for them.",1643256015,cheating,care,help_72000100 assistance synset-help-verb-1,1643256015,1,1,0
At one time in my life I want to become a professional Hitman.,2703627738,harm,harm,synset-gunman-noun-1,2703627738,1,1,1
At school I fart really loudly but everyone think it is this boy and he get send out protest his innocence.,684467934,degradation,fairness,regard,684467934,1,1,0
Awkward Questions About Sons' Adoption Don't Deserve Answers.,3029866011,harm,care,synset-adoption-noun-1,3029866011,1,1,0
"Back in grade 10 my friend choke me till I pass out because I didn’t call him the group leader. He blame me for the group split up to this day, 8 year later.",1431320480,harm,loyalty,synset-group-noun-1,1431320480,1,1,0
"Because of Percy Jackson, i think all dyslexic kid could read Greek. It wasn't until I ask my dyslexic friend in high school that I know otherwise.",4235539514,cheating,fairness,regard,4235539514,1,1,0
Becka try to bribe her way out of it but be arrest for DUI.,1828066385,harm,authority oppression,arrest synset-apprehension-noun-4,1828066385,1,2,0
Before I get addict to Minecraft I think it is call Mindcraft.,2749240740,harm,fairness,regard,2749240740,1,1,0
Bill then unplug Jim's controller and knock his character out.,3357021868,cheating,harm,synset-knock-verb-1 causeharm,3357021868,1,1,0
Bill worry that the man would hurt him and the other hostages.,3366852259,harm,harm,causeharm synset-ache-verb-3 hurt_40081000 experiencebodilyharm,3366852259,1,1,1
Bone have be poke out of my gum for week and im too scar to get it check.,2832013630,harm,harm,synset-jab-verb-1 causeharm,2832013630,1,1,1
Both her and her husband have always struggle with finances.,2534938135,harm,harm,synset-fight-verb-3,2534938135,1,1,1
Bro hat my parent and I think he want to make me do the same.,2365789421,harm betrayal,authority care,synset-parent-noun-1 synset-hat-noun-1,2365789421,2,2,0
"Bunch of people be planning, include me to beat someone up.",2035094803,harm,harm,synset-beat-verb-1,2035094803,1,1,1
But Joe call his brother one day and tell them they should play.,3712816863,harm betrayal,loyalty,synset-play-verb-1,3712816863,2,1,0
"But in the end, he heart melted, she feed the cat and keep it with her.",1667569722,harm,care oppression,synset-keep-verb-1 synset-feed-verb-1,1667569722,1,2,0
"Charles shout out, look like you teach your dog to hate blacks?.",4148369153,harm,harm,synset-hate-verb-1 hate_31020100,4148369153,1,1,1
College Student Living at Home Can't Escape Smothering Mom.,2011043039,harm,harm,killing smother_42030000,2011043039,1,1,1
Cookie be fine with one shot but Leslie dare her to drink more.,3436189280,harm subversion,harm,synset-shot-noun-2,3436189280,2,1,1
Damien be play outside one day while his parent be arguing.,2127959378,harm betrayal,authority,synset-parent-noun-1,2127959378,2,1,0
Dan could not wait until he could play Farmville on his phone.,3228702306,harm,care loyalty,synset-telephone-noun-1 synset-play-verb-1,3228702306,1,2,0
Daughter Refuses to Play Part in Mom's Reconciliation Drama.,2479822210,betrayal,loyalty,synset-play-verb-1,2479822210,1,1,0
"Devin make it out safely, but his whole house sadly go up in flames.",1189025857,harm,care,synset-house-noun-1,1189025857,1,1,0
Dispute Over Toilet Threatens to Wash Family Harmony Down the Drain.,1519720581,betrayal,harm,threaten_31010000,1519720581,1,1,0
Drama Teacher Discovers Forgotten Video of Student Who Died.,2610238865,cheating,harm,death die_48020000,2610238865,1,1,0
Dropped outta college to go to concert &amp; music festival all over the nation and do mind alter drug instead.,3531614252,harm degradation,degradation care,synset-drug-noun-1,3531614252,2,2,1
Eli decide to double the value of the donation when he file taxes.,329455513,cheating,care,synset-file-verb-1,329455513,1,1,0
Emailed Photo of Ailing Mom Is Reason to Restrict Visitors.,1843336470,cheating,oppression,inhibitmovement restrict_76000000,1843336470,1,1,0
Eric meet a woman and marry her 5 year after his wife died.,1741296762,harm betrayal,loyalty harm,death cometogether die_48020000,1741296762,2,2,1
Eventually he realize he get his friend's glass by mistake.,2352289143,harm,care,synset-glass-noun-1,2352289143,1,1,0
Every time I eat I have to watch a programme like my 600lb life to remind me to not eat bad food.,1523589406,harm,care,synset-food-noun-1,1523589406,1,1,0
Every time I go to the bar I am tempt to cheat on my girlfriend.,3314423347,harm betrayal,cheating,cheat_59000100,3314423347,2,1,0
Every time I put my lunch tray away in the cafeteria.. I leave the silverware on the tray.,2858688494,degradation,care,synset-lunch-noun-1,2858688494,1,1,0
"Every time Jan and Susan go out to lunch, Susan show up late.",2580944236,cheating,care,synset-lunch-noun-1,2580944236,1,1,0
Every time i hear a plane go by i think its a nuke thats go to drop in my city.,1198529383,harm,fairness,regard,1198529383,1,1,0
"Everyone keep say Emma look slimmer, but she didn't see it.",2215843047,harm,care oppression,synset-keep-verb-1,2215843047,1,2,0
Everyone think I am be manipulative by say I am suicidal just because I didnt go through with it.,2891653822,harm,fairness,regard,2891653822,1,1,0
Everyone think I’m good at what I do and that I have it altogether but..,106830511,cheating,fairness,regard,106830511,1,1,0
Ex husband cheat with several woman for several years... ALL I WANT IS HIM.,4243331331,harm cheating,subversion harm,synset-swindle-noun-1 offenses,4243331331,2,2,1
Ex manipulate his power to berate me over anger issue that be always his own.,1302535176,harm,authority,synset-power-noun-1,1302535176,1,1,0
Finally I place him in a pile of pillow on the floor and he calmed.,365434686,harm,loyalty harm,synset-floor-noun-1 cometogether synset-pile-noun-1,365434686,1,2,1
"For my egotistical self, I break an innocent person's heart by ghost her.",3382254121,harm cheating,fairness harm,experiencebodilyharm causeharm synset-innocent-adjective-1 break_45010000,3382254121,2,2,1
"For year as a defense mechanism, I find way not to respond to how be you? so I wouldn't be lie.",917905621,cheating betrayal,care,synset-defense-noun-1 synset-detect-verb-1 defend,917905621,2,1,0
Forbes 30 under 30 Tech Millionaire Chris Kelsey Reveals My Biggest Scams.,2865699207,cheating,betrayal,revealsecret,2865699207,1,1,0
Francine lock the child in their room and give them no food.,2486179172,harm subversion,care,synset-food-noun-1,2486179172,2,1,0
Frequently when I want people to like me and they tell unfunny joke I think of good joke and laugh sincerely.,2155095916,harm betrayal,fairness,regard,2155095916,2,1,0
Friend With Early Dementia Avoids Helping Around the House.,2066552098,harm,care,help_72000100 assistance,2066552098,1,1,0
Friends Refuse to Play Their Part in Drama Queen's Illness.,1941443774,cheating,loyalty,synset-play-verb-1,1941443774,1,1,0
Gary find out the strange man he didn't know be his friend.,1986925781,harm,care,synset-detect-verb-1,1986925781,1,1,0
Girlfriend Is Convinced That Partner's Parents Dislike Her.,2229146930,harm,fairness loyalty,synset-disfavor-noun-2 synset-spouse-noun-1 inclination,2229146930,1,2,0
Guillermo think if he hack the game he would receive rewards.,2912687646,cheating,harm,synset-chop-verb-5,2912687646,1,1,0
Had a Massage on a Well-Known Cruise Line and Had My Lady Parts Stroked.,1893341299,subversion,care,cure synset-massage-noun-1,1893341299,1,1,0
Hate with a passion people agree with you just to cut conversation short.,3744406317,cheating,fairness harm,causeharm synset-agree-verb-1 synset-cut-verb-1,3744406317,1,2,0
Hating and actively avoid a mentally challenged guy at my college.,766777386,harm,harm,hate_31020100,766777386,1,1,1
Haven’T talk to my parent in year and I regret it everyday.,3509786274,harm subversion,authority,synset-parent-noun-1,3509786274,2,1,0
He accelerate until he reach the speed limit and push it further.,79370114,subversion,oppression,synset-limit-noun-1,79370114,1,1,0
He accidently break a glass trinket that belong to his sister.,3324450470,harm,care harm,experiencebodilyharm causeharm synset-glass-noun-1 break_45010000,3324450470,1,2,1
He find out it is chicken pox when he give it to three people.,2857506273,degradation,care,synset-detect-verb-1,2857506273,1,1,0
He find out one day when he get home and the police be there.,2374898988,subversion degradation,care,synset-police-noun-1 synset-detect-verb-1,2374898988,2,1,0
He give her a kiss on the check and notice something different.,3177256599,degradation,care,synset-detect-verb-1,3177256599,1,1,0
He go to a fast food restaurant but they didn't have a dollar menu.,497948588,harm degradation,care,synset-food-noun-1,497948588,2,1,0
He have an appetite for a breakfast sandwich from Burger King.,3094025787,harm,care,synset-breakfast-noun-1,3094025787,1,1,0
"He have only his mother, and even she think he would be guilty.",3322025565,betrayal,fairness care,synset-mother-noun-1 regard,3322025565,1,2,0
"He hide and run a lot, not confident that he could fight well.",2691962304,harm,loyalty harm,synset-batch-noun-2 hostileencounter synset-contend-verb-6,2691962304,1,2,1
He is laugh look back when he didn't notice a can in front.,1647318109,harm,care harm,synset-detect-verb-1 synset-front-noun-1,1647318109,1,2,1
He is then prescribe special lotion and now his skin be better.,3667990217,harm,harm,synset-skin-noun-1,3667990217,1,1,1
He kick her out of the car for threaten him and pick a fight.,2397181230,betrayal degradation harm,harm,synset-fight-noun-2 hostileencounter,2397181230,3,1,1
He know he shouldn't eat what wasn't his but he is starving.,2226918728,cheating,harm,killing death starve_40070000,2226918728,1,1,0
He lose his balance however and fell crash through the branches.,3970766664,harm,harm,synset-lose-verb-1 attack lose_13020000,3970766664,1,1,1
He lose his job this year and couldn't afford to go this year.,2926712286,subversion,harm,synset-lose-verb-1 lose_13020000,2926712286,1,1,0
"He play on FB, which give you notification and interrupt the game.",53745568,cheating,loyalty,synset-play-verb-1,53745568,1,1,0
He shake the vending machine to try to get his chip to fall.,2345473336,cheating,harm,synset-bit-noun-2,2345473336,1,1,0
He spend the night in prison for a cause he didn't even know.,2591757680,subversion,oppression,prison synset-prison-noun-1,2591757680,1,1,0
He tell Abby and a doctor he would play a game non stop for four days.,1461196920,harm,care loyalty,synset-doctor-noun-1 synset-play-verb-1,1461196920,1,2,0
He tell the bos his daughter have be kill in India by her husband.,88086300,harm,harm,synset-killing-noun-2,88086300,1,1,1
"He try to talk to President Bush, but an undercover cop pull up.",3758429908,subversion,care,synset-bull-noun-5,3758429908,1,1,0
He use to take them to a fast food place and spend eleven dollars!.,376641404,harm degradation,care,synset-food-noun-1,376641404,2,1,0
He would crack the plastic when he would slam it down too hard.,3594655385,harm,harm,causeharm synset-crack-verb-1 crack_18030000,3594655385,1,1,1
Her husband think her obsession with cat have get out of hand.,3442218597,harm,fairness,regard,3442218597,1,1,0
Her mom be upset about her wasting food after her hard work.,2442270113,harm,care,synset-food-noun-1,2442270113,1,1,0
Her mother give her pink and red nail polish to use as paints.,3139769901,degradation,care,synset-mother-noun-1,3139769901,1,1,0
His bos have tell him that a certain horse would win the race.,3055425048,cheating,care,synset-horse-noun-1 assistance,3055425048,1,1,0
His friend convince him that it is not violence when it is self defense.,3114015229,harm,care harm,synset-violence-noun-1 defend synset-defense-noun-1,3114015229,1,2,1
His mother forget that she need to work therefore can't go with him.,1486362749,cheating harm,care,synset-mother-noun-1,1486362749,2,1,0
His mother pull over to give him a hug and tell him she love him.,4264564450,harm subversion,care,synset-mother-noun-1,4264564450,2,1,0
His parent do not want him to play outside because it is dangerous.,929110120,harm,authority loyalty,synset-parent-noun-1 synset-play-verb-1,929110120,1,2,0
"His sister come home and panicked, she couldn't find her barbie.",3939374781,harm,care,synset-detect-verb-1,3939374781,1,1,0
His uncle convince him that he should be a rock star instead.,2851804643,cheating subversion,harm,synset-rock-noun-1 causeharm,2851804643,2,1,0
His wife give him some advice that help him get over his negativity.,1180571811,harm,care,synset-help-verb-1 help_72000100 assistance,1180571811,1,1,0
Honest Teen Loses Motivation as Classmates Win by Cheating.,2274170220,cheating,cheating harm,lose_13020000 cheat_59000100 attack,2274170220,1,2,1
Husband'S Letters to Old Flame Continue to Fuel Widow's Anger.,2923173277,harm,care,supply synset-fuel-verb-1,2923173277,1,1,0
I A float jellyfish stung Sandy while she play in the ocean.,2289571158,harm,loyalty harm,causeharm synset-play-verb-1,2289571158,1,2,1
I Admitted Hypochondriac Seeks a Cure for Her Fear of Dying.,2257130702,harm,betrayal care harm,synset-fear-noun-1 revealsecret synset-remedy-noun-2 cure,2257130702,1,3,1
I Almost gun down some hiker while work in the marijuana industry.,465770559,harm,harm,synset-gun-verb-1,465770559,1,1,1
I Already think about another woman - 1 year into our marriage.,3357808205,betrayal,fairness,regard,3357808205,1,1,0
I Beat Up My Daughter's Boyfriend And Now She is Mad At Me.,1191973675,harm,harm,synset-beat-verb-1,1191973675,1,1,1
"I Being a transgender woman isn’t easy, I face oppression every day, and today I snap.",2699567106,betrayal,harm,synset-oppression-noun-1 synset-confront-verb-2 hostileencounter,2699567106,1,1,0
"I Being the vindictive sort, Billy steal their wifi password.",2739541562,harm,harm,synset-revengeful-adjectivesatellite-1 revenge,2739541562,1,1,1
"I Blackmailing didn't work, so he start follow and harass him.",2971801090,cheating,harm,synset-harass-verb-1 harass_59000100,2971801090,1,1,0
I Cheating Husband Bad-Mouths Wife Who Left Him for Another.,1955468462,harm betrayal,cheating,cheat_59000100,1955468462,2,1,0
I Common fly to Hawaii and Charles' mother be his attendant.,2014909723,harm,care,assistance synset-attendant-noun-1 synset-mother-noun-1,2014909723,1,1,0
I Constantly think of lodge a.45 caliber hollow point into my skull...,1929844917,harm,fairness,regard,1929844917,1,1,0
I Do you guy sometimes have the urge to scream and destroy every object that be near you. Just out frustration. Cause I do.,3136891915,harm,harm,synset-destroy-verb-1 destroying destroy_44000000,3136891915,1,1,1
I Ending my life today and can't get over the guilt of hurt my sister.,1552357550,harm,harm,synset-injury-noun-1,1552357550,1,1,1
I Esgtranged from farther who be die and I couldn't care less...,3737523725,harm,harm,death die_48020000 synset-die-verb-1,3737523725,1,1,1
"I Estranged from worthless father who deserve a slow death, part II.",1615730795,harm,harm,death synset-death-noun-1,1615730795,1,1,1
"I Family think my sister move in with me so she can save money, in reality it is so we can keep sleeping together.",279062691,cheating,fairness care oppression,synset-keep-verb-1 regard,279062691,1,3,0
I Father Opposed to Wedding Is Brought to His Senses by Wife.,2434864422,subversion harm betrayal cheating,loyalty,takingsides,2434864422,4,1,0
I Found out my girlfriend of 5 year make out with a coworker. I have be cheat on her for a month.,1943740803,cheating betrayal,cheating,cheat_59000100,1943740803,2,1,1
I Have be have the same reoccurring dream in which I am brutally murder innocent and smiling. Ignore my username.,3983747253,harm,harm,offenses killing synset-murder-noun-1,3983747253,1,1,1
I Have to make a desicion about my career that could ruin multiple people's life.,2446531856,harm,harm,destroying synset-destroy-verb-2 ruin_44000000,2446531856,1,1,1
I Is get off to people that cheat on their SO with me a bad thing?.,94443191,cheating,cheating,cheat_59000100,94443191,1,1,1
I Is it normal to tear up when look at picture of yourself? Because I have.,3828423256,harm,harm oppression,synset-tear-verb-1 experiencebodilyharm,3828423256,1,2,1
I Joined a prestigious university by cheat and my life have never be worse.,286137158,cheating,subversion harm,synset-swindle-noun-1 offenses,286137158,1,2,0
I Just get into a fight with one of my SOs after she refuse to validate and instead insulted my identity..,3310495203,harm,harm,synset-fight-noun-2 hostileencounter,3310495203,1,1,1
I Kicked My Oldest Daughter To The Curb And I Do Not Regret It.,2605454494,harm,harm,causeharm kick_18020000,2605454494,1,1,1
I Knowing that !!Iron Man die in End Game!! I really don't want to want to watch it now.,4275248456,cheating betrayal degradation,harm,death die_48020000 synset-die-verb-1,4275248456,3,1,0
I Listening to my classmate struggle over material I know secretly make me feel superior.,3289587931,harm subversion,harm,synset-struggle-noun-1,3289587931,2,1,1
I Looking up the movie on Wikipedia ruin the plot but I do it anyways.,1863653587,harm,harm,synset-destroy-verb-2 ruin_44000000,1863653587,1,1,1
I Lost Letters From Late Brother Spark Family Disagreement.,1827738920,harm subversion,harm,lose_13020000 attack,1827738920,2,1,1
I Lost my mom wed ring which end up be the root cause of her divorce.,1124079653,harm,harm,lose_13020000 attack,1124079653,1,1,1
"I Lying in bed, Javier remembers that he didn't brush his teeth.",3419608678,harm,care,supply synset-bed-noun-1,3419608678,1,1,0
I Not sure this be the right place for this. Thought of a disturbing revenge plan.,2866683203,harm,harm,revenge synset-retaliation-noun-1,2866683203,1,1,1
I Please do not judge me for I am merely a mortal with weakness and flaw like everybody else - I am sick and I do need help!!!.,47786777,harm,care,assistance synset-aid-noun-2,47786777,1,1,0
"I Reading all these story about bad relationships, cheating, abuse, etc. be make me scared of commitment.",3353945480,harm cheating betrayal,harm,synset-maltreatment-noun-1 abusing,3353945480,3,1,1
I Sleeping in a Walmart bathroom instead of my car tonight.,1935349041,harm,care,synset-bathroom-noun-1,1935349041,1,1,0
