text,text_hash,label,label_predicted,label_triggers,text_hash.1,label_count,label_predicted_count,label_count_matched
I take my mother in law vibrator and use them when I’m alone at home.,2586712564,cheating harm,care,synset-mother-noun-1,2586712564,2,1,0
I take premium Snapchat picture from girl and send it to their parent and create my own fake premium snapchat of them.,4159122139,harm,authority cheating,synset-parent-noun-1 synset-bogus-adjectivesatellite-1,4159122139,1,2,0
"I take two Xanax and be finish a bottle of wine. Please let me sleep tonight, universe.",812261047,harm,harm,attack please_31010000,812261047,1,1,1
I talk about a cancer patient with a coworker who's mother also have cancer.,372644704,harm betrayal,care,synset-mother-noun-1,372644704,2,1,0
I talk about video game with my son and his teammate when video game discussion have be ban by their team.,4067436040,betrayal,loyalty,synset-teammate-noun-1 collaboration synset-team-noun-1,4067436040,1,1,0
I talk to an old man just so my friend think I am a nice person.,3328120323,harm betrayal,fairness,regard,3328120323,2,1,0
I tap the tag to an expensive blazer into the sleeve because I know I am go to return it after my anniversary.,1862608729,cheating,harm,synset-tap-verb-1 causeharm,1862608729,1,1,0
I tell (and exaggerate to) my sister new crush that she use drug.,4015003404,harm cheating,degradation care,synset-drug-noun-1,4015003404,2,2,0
I tell a future doctor to be careful about how revealing her picture on social medium be.,2743345213,degradation,care,synset-doctor-noun-1,2743345213,1,1,0
I tell everyone Im vegan. but I cheat and eat egg everyday for breakfast.,2885425607,harm cheating,cheating care,synset-breakfast-noun-1 cheat_59000100,2885425607,2,2,1
"I tell him that I like the sex we have without all the toys, restraint and additional partners? sexual abuse trigger.",2526161548,degradation,harm,synset-maltreatment-noun-1 abusing,2526161548,1,1,0
I tell my S/o that PETA kill animal when she is upset after watch a lot of their video.,290528793,harm,loyalty harm,synset-kill-verb-1 kill_42030000 killing synset-batch-noun-2,290528793,1,2,1
I tell my best friend I wouldn't answer his phone call anymore.,3346339479,harm,care,synset-telephone-noun-1,3346339479,1,1,0
I tell my best friend about his brother's shit talk and ruin their relationship.,2352946503,cheating betrayal,harm,destroying synset-destroy-verb-2 ruin_44000000,2352946503,2,1,0
"I tell my bf that in case I get pregnant, I get to make the last call on whether we are keep it or not.",407249734,harm subversion,care oppression,synset-keep-verb-1,407249734,2,2,0
I tell my boyfriend I don't think I could keep do long distance.,3521582695,harm,fairness care oppression,synset-keep-verb-1 regard,3521582695,1,3,0
I tell my boyfriend he need to go see a doctor because he ask me to get blackout drunk so he could have sex with me while I am pass out.,3350605749,harm cheating,care,synset-doctor-noun-1,3350605749,2,1,0
I tell my brother's gf to take it easy with the ringing of the phone as it is annoy me.,1071390338,cheating,care,synset-telephone-noun-1,1071390338,1,1,0
"I tell my coworker about how his partner cheat on me, though it is month in the past.",619454050,harm betrayal cheating,subversion loyalty harm,synset-swindle-noun-1 synset-spouse-noun-1 offenses,619454050,3,3,1
I tell my dad he too old to find a job he really want to do.,1741034588,betrayal,care,synset-detect-verb-1,1741034588,1,1,0
I tell my dad if he tell my mum something relate to my mental health I'll cut him out of my life.,2091262442,betrayal,harm,causeharm synset-cut-verb-1 cut_23020000 experiencebodilyharm,2091262442,1,1,0
I tell my dad that my best friend die so I wouldn’t have to go to work the next day.,891297531,cheating,harm,death die_48020000 synset-die-verb-1,891297531,1,1,0
I tell my ex that I didn't appreciate her tell pretty much everyone we know she is go to break up with me before she do.,171846270,betrayal,fairness,regard,171846270,1,1,0
I tell my friend how I felt about something that happen a few day ago.,1845303479,harm,harm,happen_48030000 destroying,1845303479,1,1,1
I tell my friend parent about her boyfriend they don't know about.,528357373,betrayal subversion,authority,synset-parent-noun-1,528357373,2,1,0
I tell my friend's parent about her relationship as revenge.,2462127607,betrayal harm,authority harm,revenge synset-parent-noun-1 synset-retaliation-noun-1,2462127607,2,2,1
"I tell my friend's parent that she have just give birth to an unwanted baby, without her permission.",300426344,betrayal,authority harm,synset-parent-noun-1 synset-birth-noun-1,300426344,1,2,0
I tell my gf to call off her people who be go to jump me or I'll break it of with her.,4135787825,harm,harm,break_45010000,4135787825,1,1,1
I tell my gf to stop talk to her ex and ask her to stop go over to his house alone.,2985630966,betrayal,care,synset-house-noun-1,2985630966,1,1,0
I tell my girlfriend I would find her a little less attractive if she get a boob job.,375201299,harm betrayal,care,synset-detect-verb-1,375201299,2,1,0
I tell my girlfriend about a secret group chat conversation.,2566592063,harm betrayal,loyalty,synset-group-noun-1,2566592063,2,1,0
I tell my girlfriend that my teammate think her male friend be gay.,977147926,harm,fairness loyalty,synset-teammate-noun-1 collaboration regard,977147926,1,2,0
I tell my mother that I think she is be selfish for want to abandon her kid ASAP to persue other life interest.,2175936321,harm subversion,fairness care,synset-mother-noun-1 regard,2175936321,2,2,0
I tell my parent something my brother tell me in confidence.,2605061611,harm betrayal,authority,synset-parent-noun-1,2605061611,2,1,0
I tell my parent that I amlieved in Santa long after I stop believe so I could continue get presents.,349971472,cheating,authority,synset-parent-noun-1,349971472,1,1,0
I tell my roommate I am worry he is be abuse by his live in GF.,3122861408,harm,harm,synset-maltreatment-noun-1,3122861408,1,1,1
I tell my sister to get over a breakup that happen over a year ago.,705828805,harm subversion betrayal,harm,happen_48030000 destroying,705828805,3,1,1
I tell my spouse that girl belong in the GIRL Scouts and boys belong in the BOY Scouts.,1112612437,cheating,loyalty,synset-spouse-noun-1,1112612437,1,1,0
I tell my step-father that my mother have be cheat on him right around Christmas.,2733514040,betrayal cheating,cheating care,synset-mother-noun-1 cheat_59000100,2733514040,2,2,1
I tell my tourist guide he should have wait for the whole group.,4037023552,cheating,loyalty,synset-group-noun-1,4037023552,1,1,0
"I tell my wife she is expect to cook, clean dishes, and do the laundry.",1997478095,cheating betrayal,care,synset-laundry-noun-1,1997478095,2,1,0
I tell someone I don't know that their spouse may be involve in an emotional affair.,4135329335,cheating betrayal,loyalty,synset-spouse-noun-1,4135329335,2,1,0
I think I am OCD because I don't want to admit how much my mom hurt me as a child. I seek to find a way to not deal with my pain through OCD.,188428164,harm,betrayal fairness care harm,causeharm synset-pain-noun-1 regard synset-detect-verb-1 synset-ache-verb-3 revealsecret hurt_40081000 experiencebodilyharm,188428164,1,4,1
I think I am fall in love with a guy in a casual relationship.,2465273262,cheating,fairness,regard,2465273262,1,1,0
I think I just realize that I am only attracted to abusive women..,167188349,betrayal degradation,fairness,regard,167188349,2,1,0
I think I legit hate men. And I don’t think I could love my own hypothetical child if he is a boy.,4100268883,harm,fairness harm,synset-hate-noun-1 regard,4100268883,1,2,1
I think I may have a problem with flirting? Or maybe I am just tell nice?.,3199605137,harm betrayal,fairness,regard,3199605137,2,1,0
I think I might actually become a highschool dropout this week.,3526891260,harm subversion,fairness,regard,3526891260,2,1,0
I think I might be a psychopath or sociopath and I am ok with it.,3909883531,harm,fairness,regard,3909883531,1,1,0
I think I might have lung cancer from smoke but I am such a coward that I can't go to the doctor.,1826890099,harm,fairness care,synset-doctor-noun-1 regard,1826890099,1,2,0
I think I need to break off my engagement because of my fiancé’s brother.,271260835,degradation,fairness,regard,271260835,1,1,0
I think I wanna be single. I can't handle my mentally ill GF.,2055672967,harm,fairness,regard,2055672967,1,1,0
I think a guy that follow me out of a store to ask if I am single be creepy.,4080081462,cheating degradation,fairness,regard,4080081462,2,1,0
I think about cheat on my husband more than i should but hear me out.,1568872585,harm cheating betrayal,fairness subversion harm,synset-swindle-noun-1 offenses regard,1568872585,3,3,1
I think about cheat on my mentally sick girlfriend every moment I’m alive and I’m go insane consider it.,2541627608,cheating,fairness subversion harm,synset-swindle-noun-1 offenses regard,2541627608,1,3,0
I think about withdraw what money I can from my account and disappearing for good.,3549109715,harm cheating,fairness care harm,synset-can-verb-1 causeharm preserving regard,3549109715,2,3,1
"I think derogatory term for white people be actually funny sounding, not insulting.",295378706,harm degradation,fairness,regard,295378706,2,1,0
"I think everyone’s jealous of me, that’s the issue.. it isn’t me, it’s you.",1638211832,cheating,fairness,regard,1638211832,1,1,0
I think fat people should lose some weight for health reason.,2944079449,harm,fairness harm,synset-lose-verb-1 attack regard lose_13020000,2944079449,1,2,1
I think finder keeper applies to thrift shopping with a friend.,3839825705,cheating,fairness care,synset-custodian-noun-1 defend regard,3839825705,1,2,0
I think im go through a depressive episode and no one notice.,2780763643,harm cheating,fairness,regard,2780763643,2,1,0
I think it is funny when rich people complain on how they get treated.,2103843165,betrayal subversion,fairness,regard,2103843165,2,1,0
I think jackelopes be real until about ten minute ago. I’m almost 15.,2780830158,harm,fairness,regard,2780830158,1,1,0
I think my boss' coworker be a narcissist who have it out for me.,4202305297,cheating harm,fairness,regard,4202305297,2,1,0
I think my brother's family be seriously mistreat their pets..,3394967251,harm degradation,fairness harm,abusing synset-mistreat-verb-1 regard,3394967251,2,2,1
I think my family be abusive but I don't want to believe it.,2159613178,subversion,fairness,regard,2159613178,1,1,0
I think my flatmate be a spoiled brat that's way too attached to her mother.,248257320,harm subversion,fairness care,synset-mother-noun-1 regard,248257320,2,2,0
I think my friend be a snake for ask my date for her number.,2019955943,betrayal,fairness care,synset-date-noun-1 regard,2019955943,1,2,0
I think my friend indirectly cause me to start develop an eating disorder.,4107344689,harm betrayal,fairness,regard,4107344689,2,1,0
I think my sister would know that she couldn't get into a bar.,3305313825,harm subversion,fairness,regard,3305313825,2,1,0
I think my wife be go to tell me she want a divorce and I couldn’t be happier.,1743854769,betrayal,fairness,regard,1743854769,1,1,0
"I think that Brick &amp; Mortar store play Christmas music as a money grab, so I don't shop in them and go online.",4101777329,cheating,fairness,regard,4101777329,1,1,0
I think that one of the stupid thing a mother can do be name her kid Abcde.,3915127285,harm,fairness care,synset-mother-noun-1 regard,3915127285,1,2,0
"I think the columbine shooter might have be good guy if they hadn't do the shooting, and I have start to dress more and more like Eric.",3600887768,harm,fairness care,synset-taw-noun-2 regard,3600887768,1,2,0
I think the parent on parental leave should be the one get up with the baby at night.,536944202,harm betrayal,authority fairness,synset-parent-noun-1 regard,536944202,2,2,0
I think the portrayal of DMV employee as sloth in Zootopia be the most accurate portrayal of DMV employee ever capture on film.,1939942899,harm cheating,fairness,regard,1939942899,2,1,0
I think there be a curse among the famales on the maternal side of my family.,582753112,subversion,fairness,regard,582753112,1,1,0
I think two straight girl make out and about to have sex be an automatic invitation to a threesome.,10167313,degradation harm cheating,fairness,regard,10167313,3,1,0
I threaten to key my neighbor car because he wouldn’t park properly.,2495617697,harm,harm,threaten_31010000 synset-threaten-verb-2,2495617697,1,1,1
I threaten to throw the previous home owner mail from the IRS in the garbage.,1248336803,subversion,harm,threaten_31010000 synset-threaten-verb-2,1248336803,1,1,0
I throw a stone and it hit a disabled kid square in the face.,2443384116,harm,harm,synset-rock-noun-1 causeharm experiencebodilyharm,2443384116,1,1,1
I throw out a bunch of pack away stuff without consult my wife.,3530036976,betrayal,loyalty,synset-bunch-noun-1,3530036976,1,1,0
I throw palm tree leave from my neighbor's tree back over their fence.,2135103791,harm,care,synset-fence-noun-1 protecting,2135103791,1,1,0
I try to make my girlfriend shower when she doesn't want to.,2466321823,harm,care,synset-shower-noun-1 grooming,2466321823,1,1,0
I turn a threat crazy situation into a positive one where I educate the one who threaten me.,417997152,harm,harm,threaten_31010000,417997152,1,1,1
"I unknowingly creep a girl out and make her uncomfortable, thinking we are friend.",3748404712,harm,fairness,regard,3748404712,1,1,0
I use the fact that my ex-friend beat someone to death to get leverage at school.,2476940515,harm,harm,causeharm death synset-death-noun-1 synset-beat-verb-1,2476940515,1,1,1
I use to poke hole in the plastic wrap of package meat when I am little.,2559514944,degradation,harm,synset-jab-verb-1 causeharm,2559514944,1,1,0
I use to sneak my family outside dog into my room at night so that he could sleep on my bed.,4149944483,harm cheating betrayal,care,supply synset-bed-noun-1,4149944483,3,1,0
I use to tell my mum that google turn off the internet after 7pm so that I didn’t have to help her.,899622025,betrayal,care,synset-help-verb-1 help_72000100 assistance,899622025,1,1,0
I use to view meme from an Instagram user call Ifunny meme.,1882526984,cheating,fairness,regard,1882526984,1,1,0
I use to work at Disneyland and find a way to steal cash regularly.,514791395,cheating,care,synset-detect-verb-1,514791395,1,1,0
"I verbalize exactly what I expect (plus boundaries, rules, etc) from a potential boyfriend/husband on the first date.",3398969979,subversion,care,synset-date-noun-1,3398969979,1,1,0
"I wanna run away, somewhere, anywhere but home, to find a new home.",723654550,harm subversion,care,synset-detect-verb-1,723654550,2,1,0
I want a girl to push me against the wall and force me to make out with her while I just take it with tear run down my face.,2557029258,harm cheating,care oppression,synset-wall-noun-1 force_59000000,2557029258,2,2,0
I want a hysterectomy but I’m afraid nobody will want to be with me when they find out I can’t have babies.,326183252,harm subversion,care,synset-detect-verb-1,326183252,2,1,0
I want my dog back after he is be with my parent for 2 year.,1904940155,cheating,authority,synset-parent-noun-1,1904940155,1,1,0
I want something bad to happen to me so I have an excuse to feel sorry for myself.,2963152155,harm,harm,happen_48030000 destroying,2963152155,1,1,1
I want to be in a relationship but now that I am 2 mo in with my BF I am paranoid I am gonna lose my independence.,2842699494,subversion,liberty harm,synset-lose-verb-1 attack lose_13020000 synset-independence-noun-1,2842699494,1,2,0
"I want to break the heart of a girl I’ve like for years, and I don’t even have a reason.",43196789,harm,harm,experiencebodilyharm causeharm break_45010000,43196789,1,1,1
I want to choke that one user on this sub out between my thighs.,3792705279,harm,harm,causeharm choke_40070000 experiencebodilyharm,3792705279,1,1,1
I want to cut myself to make the people around me understand that I am not okay.,2294488216,harm degradation,harm,causeharm synset-cut-verb-1 experiencebodilyharm,2294488216,2,1,1
I want to cut tie with my close friend of 4 year because I don't want to deal with his drama anymore.,4254409565,harm,harm,causeharm synset-cut-verb-1 experiencebodilyharm,4254409565,1,1,1
I want to distance myself from old friend because I find out they are cheat on their so.,2147229543,harm betrayal,cheating care,synset-detect-verb-1 cheat_59000100,2147229543,2,2,0
I want to drop out of my junior year at college and take a job offer as a cop but family.,2120818463,subversion,care,synset-bull-noun-5,2120818463,1,1,0
I want to go to a house party that my girlfriend doesnt want me to go to.,3153992181,harm betrayal,care,synset-house-noun-1,3153992181,2,1,0
I want to leave a store where my partner embarrass me publically.,20387792,harm,loyalty,synset-spouse-noun-1,20387792,1,1,0
I want to live somewhere where it is easy to meet transwomen.,2868254294,harm subversion,loyalty,cometogether,2868254294,2,1,0
I want to pick a fight with my parent for not be there for me more often.,2974751162,harm,authority harm,synset-parent-noun-1 hostileencounter synset-fight-noun-2,2974751162,1,2,1
I want to sleep at night while my wife take care of our newborn.,3732084429,cheating,care,synset-care-noun-1,3732084429,1,1,0
I want to stop weird housemate fucking in communal shower at 5am and then leave gf in his bedroom when he go out.,558966903,harm cheating,care,synset-shower-noun-1 grooming,558966903,2,1,0
I want to take my 3-year-old on a 7-hour round trip to visit my boyfriend's mom for her birthday.,1680286238,harm betrayal,loyalty,synset-visit-verb-1,1680286238,2,1,0
I want to tell people I struggle with Anorexia but be currently “not thin enough” to convince anyone how severe it’s gotten.,2444505739,harm,harm,synset-fight-verb-3,2444505739,1,1,1
"I want to test if a certain person be in love with me, and hurt her feeling in the process.",3071614998,harm,harm,causeharm synset-ache-verb-3 hurt_40081000 experiencebodilyharm,3071614998,1,1,1
I want to watch the NZ shoot Video and find a link but stop because you have to download it and now I am ashamed of myself that I want to watch it.,3784323967,cheating subversion,care loyalty,socialconnection synset-detect-verb-1 synset-link-noun-1,3784323967,2,2,0
I wasn't ever bully in school but I am a victim of racism almost everyday.,3390511713,cheating degradation,cheating harm,synset-victim-noun-1 synset-racism-noun-2,3390511713,2,2,1
I watch Girl Meets World because I think those two kid be so hot. But I am 26.,743709187,degradation,fairness,regard,743709187,1,1,0
"I whenever i see troll comment i laugh think about a angry person furiously type away at their computer, angry over something they created.",4139922301,harm betrayal,fairness care,synset-computer-noun-1 regard,4139922301,2,2,0
I will NEVER help a republican with anything and neither should you.,824252523,cheating harm,care,synset-help-verb-1 help_72000100 assistance,824252523,2,1,0
I will not change my lifestyle because of the climate change and I dont care if I could do a positive change.,1421551225,harm,care,synset-care-noun-1,1421551225,1,1,0
I win ticket to a show for my husband but I am not go to take him.,4260632240,cheating betrayal,care,supply synset-ticket-noun-1,4260632240,2,1,0
I wish bad thing happen to people who brag about how great their life are.,3718257266,harm,harm,happen_48030000 destroying,3718257266,1,1,1
"I wish that instead of Area51, people should raid the White House and put this racist imbecile to sleep.",2068915430,harm cheating,harm,raid_35040000 attack,2068915430,2,1,1
I wish there be another holocaust so I could save some Jewish women.,1253841034,harm,harm,killing synset-holocaust-noun-1,1253841034,1,1,1
I won't be friend with anyone who still live at home at 30+.,2180584563,subversion cheating harm,care,synset-dwelling-noun-1,2180584563,3,1,0
I work at a place where I’m abuse all the time but can’t afford to quit my job. What do I do????.,1556292589,harm,harm,synset-maltreatment-noun-1,1556292589,1,1,1
I work for Amazon.com and help them violate our constitutional and human rights.,2525371782,harm,care,synset-help-verb-1 help_72000100 assistance,2525371782,1,1,0
I work for Big Pharma..I am force to keep quiet about lot of stuff..I quit work just so I can tell you!.,1244603299,cheating betrayal,care loyalty oppression,synset-batch-noun-2 synset-keep-verb-1,1244603299,2,3,0
"I work for a beachside city give park tickets, except I ignore most car I’m suppose to write ticket for.",40707832,cheating subversion,care,synset-ticket-noun-1,40707832,2,1,0
I work for the most hated internet publish company in the world.finally quit 2 month ago but nobody know.,4120389223,harm,care,synset-print-verb-1,4120389223,1,1,0
I work in IT and I purposely mess with my Grandma's computer just so I can see her smile when I fix it for her.,2011440793,cheating,care,synset-computer-noun-1,2011440793,1,1,0
"I work in a call center and if it isn't too busy in the last few minute of my shift, I will ring my phone out so I don't get any more calls.",1266757736,betrayal,care,synset-telephone-noun-1,1266757736,1,1,0
I worry about the fact that my girlfriend smoke a joint with a random homeless man.,4082245168,degradation,care,synset-joint-noun-1,4082245168,1,1,0
I would be really mean to my friend cat grow up and have an urge to torment my girlfriend dog.,763306396,harm,harm,torment_31010000 causeharm,763306396,1,1,1
I would love to see a video of a bunch of white kid be tie up and burn alive as they areg and cry for their mom mmm.,695806031,harm subversion,loyalty harm oppression,inhibitmovement synset-bunch-noun-1 tie_22040000 synset-tie-verb-1 synset-burn-verb-1 experiencebodilyharm,695806031,2,3,1
"I would never adopt a “special needs” animal, and I don’t think its fair to keep them alive.",1476470122,harm,fairness care oppression,synset-keep-verb-1 regard,1476470122,1,3,0
"I would never think of feed them,providing them their needs.",2580682223,harm,fairness care,supply synset-feed-noun-1 assistance regard,2580682223,1,2,0
I wrongly approve many patient medical prior authorization when the computer say not to.,3508347200,cheating,care harm,synset-computer-noun-1 synset-approve-verb-1,3508347200,1,2,0
"I “Being close to money, make you care less about what people think of you” Do you agree ?.",2907448107,harm cheating,fairness care,synset-agree-verb-1 care_31030200 regard,2907448107,2,2,0
Id like to get shot and live just to have the experience of get shot.,1389566094,harm,harm,synset-shot-noun-2,1389566094,1,1,1
If I ever see a transgender in person I’m go to beat them to a pulp.,1936464155,harm cheating,harm,causeharm synset-beat-verb-1 synset-pulp-noun-1,1936464155,2,1,1
"If I outlive my dog, I don’t think I’ll be able to continue on.",1073944782,harm,fairness,regard,1073944782,1,1,0
"If war do start, we should only draft white folk for all the bad thing they do to people of color.",3064931019,harm subversion,harm,synset-war-noun-1,3064931019,2,1,1
If you don't support your local drug dealer you are anti blak.,3323729512,harm,degradation care loyalty,takingsides synset-drug-noun-1,3323729512,1,3,0
Im cheat on my girlfriend with a pregnant coworker who be engaged.,543954939,subversion,subversion harm,synset-swindle-noun-1 offenses,543954939,1,2,1
"Im really worry for my brother, but I’m start to hate him at the same time.",1523129400,harm betrayal degradation,harm,synset-hate-verb-1 hate_31020100,1523129400,3,1,1
"In 7th grade, I go into my friend's email and send an extremely rude message to the vice principal we both hated.",2929010653,harm,harm,hate_31020100,2929010653,1,1,1
In HS my captain position on the cheerleading team be in jeopardy so i rat out my competition.,938680819,subversion,loyalty,synset-team-noun-1,938680819,1,1,0
"In a long distance relationship, but I havebeen cheat and I don't feel even slightly bad. help.",1342579047,cheating,care subversion harm,assistance synset-swindle-noun-1 synset-aid-noun-2 offenses,1342579047,1,3,0
In high school I use to punch the weird weaboo kid who watch anime in the nut every day.,1730027325,harm cheating,harm,causeharm synset-punch-verb-1 punch_18020000,1730027325,2,1,1
In middle school I use to leave class and go to the bathroom to jack off and when I come back they wonder why I am go for the past 35 minute.,2760061124,cheating,care,synset-bathroom-noun-1,2760061124,1,1,0
"In my last school, everyone think I am really smart, truth is, I am just good at memorize stuff and bullshit my way out of things.",3575787143,cheating,fairness,regard,3575787143,1,1,0
It hit his teacher in the head and Bobby get in a lot of trouble.,3818526325,harm,loyalty harm,causeharm synset-batch-noun-2 experiencebodilyharm,3818526325,1,2,1
It is a literal racist dog whistle and my family and their friend think it is hilarious.,2067406815,harm,cheating harm,synset-racist-noun-1,2067406815,1,2,1
"It is almost like he is burn the nasty, frightful idea inside.",3028293171,degradation,harm,synset-burn-verb-1 experiencebodilyharm,3028293171,1,1,0
It is my birthday and can't help but be sad. Does anyone feel the same?.,2330990781,harm,care,synset-help-verb-1 help_72000100 assistance,2330990781,1,1,0
"It keep him from sleep at night, and this make him grouchy.",1814566111,harm,care oppression,synset-keep-verb-1,1814566111,1,2,0
It really anger me when I see fat people eat unhealthy food.,2236355936,harm,care,synset-food-noun-1,2236355936,1,1,0
It seem that every computer at her work have this virus on it.,3376420487,harm,care,synset-computer-noun-1,3376420487,1,1,0
